{
  "$schema": "http://json-schema.org/draft-07/schema#",
  "$id": "https://jtk25.my.id/schemas/rooms.json",
  "title": "Rooms",
  "description": "Daftar ruangan di JTK",
  "type": "object",
  "required": ["schema", "semester", "updatedAt", "data"],
  "properties": {
    "schema": {
      "type": "integer",
      "const": 2
    },
    "semester": {
      "type": "string",
      "pattern": "^\\d{4}/\\d{4}-(GANJIL|GENAP)$"
    },
    "updatedAt": {
      "type": "string",
      "format": "date-time"
    },
    "data": {
      "type": "array",
      "items": {
        "$ref": "#/$defs/Room"
      }
    }
  },
  "additionalProperties": false,
  "$defs": {
    "Room": {
      "type": "object",
      "required": ["id", "name"],
      "properties": {
        "id": {
          "type": "string",
          "minLength": 1,
          "description": "Room identifier, e.g. D108-Kelas"
        },
        "name": {
          "type": "string",
          "minLength": 1,
          "description": "Room display name"
        },
        "type": {
          "type": "string",
          "enum": ["kelas", "lab", "online"],
          "description": "Room type: kelas (classroom), lab (laboratory), or online (virtual room for remote sessions)"
        }
      },
      "additionalProperties": false
    }
  }
}
